{
  "version": 1,
  "revision": 3,
  "status": "draft",
  "visibility": "author_only",
  "subsection_plan": "storyboard/chapter-subsections.json",
  "subsection_revision": 3,
  "workflow": {
    "execution": "implemented",
    "prose": "outline",
    "dialogue_coverage": "partial",
    "public_reader": "unchanged"
  },
  "origin": "authored",
  "metadata": {
    "addition": true,
    "kind": "new_setting",
    "note": "추가: 소단락용 공용 분기 시스템의 초안. 원작 조건을 참고한 영입과 편집 순서, 준비·역할·후속 반응을 구조화했다. 주인공에게 무기고 기본 무기를 지급하는 준비 경로는 새 집필 설정이다. 기존 선택형 첫 장의 상태·저장 파일과 자동 호환되지 않는다.",
    "knowledge_policy": "author_reference_not_character_knowledge"
  },
  "state_definitions": {
    "party.members": {
      "type": "string_set",
      "initial": [
        "protagonist",
        "party_woodcutter",
        "party_hunter",
        "party_cook",
        "party_magician"
      ],
      "authority": "branch",
      "description": [
        {
          "text": "현재 동행 인물의 ID. 영입 경험과 분리한다."
        }
      ],
      "reference_catalog": "characters",
      "values": null,
      "holder": null,
      "minimum": 0,
      "maximum": 6,
      "origin": "authored",
      "metadata": {
        "addition": true,
        "kind": "new_setting",
        "note": "추가: 소단락 기반 분기 실행과 상태 추적의 집필 규칙. 게임 규칙·원작 확정 사실·승인 본문이 아니다.",
        "knowledge_policy": "author_reference_not_character_knowledge"
      }
    },
    "party.optional": {
      "type": "string",
      "initial": "",
      "authority": "branch",
      "description": [
        {
          "text": "여섯 번째 동료 자리의 현재 인물 ID."
        }
      ],
      "reference_catalog": "characters",
      "values": [
        "",
        "skeleton",
        "spica"
      ],
      "holder": null,
      "minimum": 0,
      "maximum": 100,
      "origin": "authored",
      "metadata": {
        "addition": true,
        "kind": "new_setting",
        "note": "추가: 소단락 기반 분기 실행과 상태 추적의 집필 규칙. 게임 규칙·원작 확정 사실·승인 본문이 아니다.",
        "knowledge_policy": "author_reference_not_character_knowledge"
      }
    },
    "inventory": {
      "type": "string_set",
      "initial": [
        "story_axe",
        "story_bow",
        "story_knife",
        "story_wand"
      ],
      "authority": "branch",
      "description": [
        {
          "text": "실제 획득한 장비 ID의 집합. 사전 등록은 획득이 아니다."
        }
      ],
      "reference_catalog": "equipment",
      "values": null,
      "holder": null,
      "minimum": 0,
      "maximum": 100,
      "origin": "authored",
      "metadata": {
        "addition": true,
        "kind": "new_setting",
        "note": "추가: 소단락 기반 분기 실행과 상태 추적의 집필 규칙. 게임 규칙·원작 확정 사실·승인 본문이 아니다.",
        "knowledge_policy": "author_reference_not_character_knowledge"
      }
    },
    "party.rank": {
      "type": "string",
      "initial": "",
      "authority": "main",
      "description": [
        {
          "text": "마지막 도움 뒤 현재 일행의 계급 변화. 인물의 고정 직업·생사와 별개다."
        }
      ],
      "reference_catalog": "terms",
      "values": [
        "",
        "semi_god"
      ],
      "holder": null,
      "minimum": 0,
      "maximum": 100,
      "origin": "authored",
      "metadata": {
        "addition": true,
        "kind": "new_setting",
        "note": "추가: 소단락 기반 분기 실행과 상태 추적의 집필 규칙. 게임 규칙·원작 확정 사실·승인 본문이 아니다.",
        "knowledge_policy": "author_reference_not_character_knowledge"
      }
    },
    "experience.armory": {
      "type": "boolean",
      "initial": false,
      "authority": "branch",
      "description": [
        {
          "text": "무기고를 이용한 준비 경험."
        }
      ],
      "reference_catalog": null,
      "values": null,
      "holder": null,
      "minimum": 0,
      "maximum": 100,
      "origin": "authored",
      "metadata": {
        "addition": true,
        "kind": "new_setting",
        "note": "추가: 소단락 기반 분기 실행과 상태 추적의 집필 규칙. 게임 규칙·원작 확정 사실·승인 본문이 아니다.",
        "knowledge_policy": "author_reference_not_character_knowledge"
      }
    },
    "experience.skeleton_conversation": {
      "type": "boolean",
      "initial": false,
      "authority": "branch",
      "description": [
        {
          "text": "동행 전 제안자와 대화를 더 나눈 경험."
        }
      ],
      "reference_catalog": null,
      "values": null,
      "holder": null,
      "minimum": 0,
      "maximum": 100,
      "origin": "authored",
      "metadata": {
        "addition": true,
        "kind": "new_setting",
        "note": "추가: 소단락 기반 분기 실행과 상태 추적의 집필 규칙. 게임 규칙·원작 확정 사실·승인 본문이 아니다.",
        "knowledge_policy": "author_reference_not_character_knowledge"
      }
    },
    "experience.recruits": {
      "type": "string_set",
      "initial": [],
      "authority": "branch",
      "description": [
        {
          "text": "실제로 영입했던 인물의 기록. 현재 동행을 뜻하지 않는다."
        }
      ],
      "reference_catalog": "characters",
      "values": null,
      "holder": null,
      "minimum": 0,
      "maximum": 100,
      "origin": "authored",
      "metadata": {
        "addition": true,
        "kind": "new_setting",
        "note": "추가: 소단락 기반 분기 실행과 상태 추적의 집필 규칙. 게임 규칙·원작 확정 사실·승인 본문이 아니다.",
        "knowledge_policy": "author_reference_not_character_knowledge"
      }
    },
    "experience.rigel_aid": {
      "type": "string",
      "initial": "",
      "authority": "branch",
      "description": [
        {
          "text": "부상자 지원에서 실제 택한 역할."
        }
      ],
      "reference_catalog": null,
      "values": [
        "",
        "cook",
        "magician",
        "together"
      ],
      "holder": null,
      "minimum": 0,
      "maximum": 100,
      "origin": "authored",
      "metadata": {
        "addition": true,
        "kind": "new_setting",
        "note": "추가: 소단락 기반 분기 실행과 상태 추적의 집필 규칙. 게임 규칙·원작 확정 사실·승인 본문이 아니다.",
        "knowledge_policy": "author_reference_not_character_knowledge"
      }
    },
    "experience.shelter_preparation": {
      "type": "string",
      "initial": "",
      "authority": "branch",
      "description": [
        {
          "text": "피난처에서 택한 결전 준비 방식."
        }
      ],
      "reference_catalog": null,
      "values": [
        "",
        "food",
        "equipment"
      ],
      "holder": null,
      "minimum": 0,
      "maximum": 100,
      "origin": "authored",
      "metadata": {
        "addition": true,
        "kind": "new_setting",
        "note": "추가: 소단락 기반 분기 실행과 상태 추적의 집필 규칙. 게임 규칙·원작 확정 사실·승인 본문이 아니다.",
        "knowledge_policy": "author_reference_not_character_knowledge"
      }
    },
    "equipment.protagonist": {
      "type": "string",
      "initial": "",
      "authority": "branch",
      "description": [
        {
          "text": "현재 동행자의 실제 장착 장비 ID. 빈 값은 미지정이다."
        }
      ],
      "reference_catalog": "equipment",
      "values": null,
      "holder": "protagonist",
      "minimum": 0,
      "maximum": 100,
      "origin": "authored",
      "metadata": {
        "addition": true,
        "kind": "new_setting",
        "note": "추가: 소단락 기반 분기 실행과 상태 추적의 집필 규칙. 게임 규칙·원작 확정 사실·승인 본문이 아니다.",
        "knowledge_policy": "author_reference_not_character_knowledge"
      }
    },
    "equipment.party_woodcutter": {
      "type": "string",
      "initial": "story_axe",
      "authority": "branch",
      "description": [
        {
          "text": "현재 동행자의 실제 장착 장비 ID. 빈 값은 미지정이다."
        }
      ],
      "reference_catalog": "equipment",
      "values": null,
      "holder": "party_woodcutter",
      "minimum": 0,
      "maximum": 100,
      "origin": "authored",
      "metadata": {
        "addition": true,
        "kind": "new_setting",
        "note": "추가: 소단락 기반 분기 실행과 상태 추적의 집필 규칙. 게임 규칙·원작 확정 사실·승인 본문이 아니다.",
        "knowledge_policy": "author_reference_not_character_knowledge"
      }
    },
    "equipment.party_hunter": {
      "type": "string",
      "initial": "story_bow",
      "authority": "branch",
      "description": [
        {
          "text": "현재 동행자의 실제 장착 장비 ID. 빈 값은 미지정이다."
        }
      ],
      "reference_catalog": "equipment",
      "values": null,
      "holder": "party_hunter",
      "minimum": 0,
      "maximum": 100,
      "origin": "authored",
      "metadata": {
        "addition": true,
        "kind": "new_setting",
        "note": "추가: 소단락 기반 분기 실행과 상태 추적의 집필 규칙. 게임 규칙·원작 확정 사실·승인 본문이 아니다.",
        "knowledge_policy": "author_reference_not_character_knowledge"
      }
    },
    "equipment.party_cook": {
      "type": "string",
      "initial": "story_knife",
      "authority": "branch",
      "description": [
        {
          "text": "현재 동행자의 실제 장착 장비 ID. 빈 값은 미지정이다."
        }
      ],
      "reference_catalog": "equipment",
      "values": null,
      "holder": "party_cook",
      "minimum": 0,
      "maximum": 100,
      "origin": "authored",
      "metadata": {
        "addition": true,
        "kind": "new_setting",
        "note": "추가: 소단락 기반 분기 실행과 상태 추적의 집필 규칙. 게임 규칙·원작 확정 사실·승인 본문이 아니다.",
        "knowledge_policy": "author_reference_not_character_knowledge"
      }
    },
    "equipment.party_magician": {
      "type": "string",
      "initial": "story_wand",
      "authority": "branch",
      "description": [
        {
          "text": "현재 동행자의 실제 장착 장비 ID. 빈 값은 미지정이다."
        }
      ],
      "reference_catalog": "equipment",
      "values": null,
      "holder": "party_magician",
      "minimum": 0,
      "maximum": 100,
      "origin": "authored",
      "metadata": {
        "addition": true,
        "kind": "new_setting",
        "note": "추가: 소단락 기반 분기 실행과 상태 추적의 집필 규칙. 게임 규칙·원작 확정 사실·승인 본문이 아니다.",
        "knowledge_policy": "author_reference_not_character_knowledge"
      }
    },
    "keys.water": {
      "type": "boolean",
      "initial": false,
      "authority": "main",
      "description": [
        {
          "text": "해당 보고 뒤 실제로 얻은 통행 열쇠."
        }
      ],
      "reference_catalog": null,
      "values": null,
      "holder": null,
      "minimum": 0,
      "maximum": 100,
      "origin": "authored",
      "metadata": {
        "addition": true,
        "kind": "new_setting",